key,prop,val,p1,v1,,,,,,,,,,
Referência,observationAbout,country/BRA,observationDate,{Data},,,,,,,,,,
"Pessoas cadastradas com renda total até R$ 622,00",measuredProperty,count,populationType,Person,income,[622 BRL],registeredIn,Brazil_SingleRegistry,value,{Number},description,"""Registered people with total income up to R$622.00""",alternateName,"""Pessoas cadastradas com renda total até R$ 622,00@pt"""
"Pessoas cadastradas com renda total de 622,01 a 1.244,00",measuredProperty,count,populationType,Person,income,[622 1244 BRL],registeredIn,Brazil_SingleRegistry,value,{Number},description,"""Registered people with total income of 622.01 to 1,244.00""",alternateName,"""Pessoas cadastradas com renda total de 622,01 a 1.244,00@pt"""
"Pessoas cadastradas com renda total de 1.244,01 a 1.866,00",measuredProperty,count,populationType,Person,income,[1244 1866 BRL],registeredIn,Brazil_SingleRegistry,value,{Number},description,"""Registered people with total income of 1,244.01 to 1,866.00""",alternateName,"""Pessoas cadastradas com renda total de 1.244,01 a 1.866,00@pt"""
"Pessoas cadastradas com renda total maior que 1.866,00",measuredProperty,count,populationType,Person,income,[1866 - BRL],registeredIn,Brazil_SingleRegistry,value,{Number},description,"""Registered people with total income greater than 1,866.00""",alternateName,"""Pessoas cadastradas com renda total maior que 1.866,00@pt"""