key,prop,val,p1,v1,,,,,,,,,,
Referência,observationAbout,country/BRA,observationDate,{Data},,,,,,,,,,
Quantidade de pessoas brancas inscritas no Cadastro Único,measuredProperty,count,populationType,Person,race,Brazil_Branca,value,{Number},name,"""Number of white people registered in the Single Registry""",alternateName,"""Quantidade de pessoas brancas inscritas no Cadastro Único@pt""",registeredIn,Brazil_SingleRegistry
Quantidade de pessoas pretas inscritas no Cadastro Único,measuredProperty,count,populationType,Person,race,Black,value,{Number},name,"""Number of black people registered in the Single Registry""",alternateName,"""Quantidade de pessoas pretas inscritas no Cadastro Único@pt""",registeredIn,Brazil_SingleRegistry
Quantidade de pessoas amarelas inscritas no Cadastro Único,measuredProperty,count,populationType,Person,race,Brazil_Amarela,value,{Number},name,"""Number of yellow people registered in the Single Registry""",alternateName,"""Quantidade de pessoas amarelas inscritas no Cadastro Único@pt""",registeredIn,Brazil_SingleRegistry
Quantidade de pessoas pardas inscritas no Cadastro Único,measuredProperty,count,populationType,Person,race,Brazil_Pardo,value,{Number},name,"""Number of brown people registered in the Single Registry""",alternateName,"""Quantidade de pessoas pardas inscritas no Cadastro Único@pt""",registeredIn,Brazil_SingleRegistry
Quantidade de pessoas indígenas inscritas no Cadastro Único,measuredProperty,count,populationType,Person,race,Brazil_Indigneous,value,{Number},name,"""Number of indigenous people registered in the Single Registry""",alternateName,"""Quantidade de pessoas indígenas inscritas no Cadastro Único@pt""",registeredIn,Brazil_SingleRegistry
Quantidade de pessoas sem informação sobre raça/cor inscritas no Cadastro Único,measuredProperty,count,populationType,Person,race,UnknownRace,value,{Number},name,"""Number of people without information about race/color registered in the Single Registry""",alternateName,"""Quantidade de pessoas sem informação sobre raça/cor inscritas no Cadastro Único@pt""",registeredIn,Brazil_SingleRegistry