key,prop,val,p1,v1,p2,v2,,,,,,,,,,,,,,
Valor investido na aquisição de veículos de passeio,value,{Number},populationType,EconomicActivity,benefitProgram,BRA_MobilityStructureUnifiedSocialAssistanceSystem,measuredProperty,investment,vehicleType,PassengerVehicle,,,unit,BRL,observationPeriod,P1Y,name,"""Amount invested in the acquisition of passenger vehicles by Mobility Structure Social Assistance System""",nameWithLanguage,"""Valor investido na aquisição de veículos de passeio pela Estrutura de Mobilidade no Sistema Único de Assistência Social@pt"""
Valor investido na aquisição de micro-ônibus,value,{Number},populationType,EconomicActivity,benefitProgram,BRA_MobilityStructureUnifiedSocialAssistanceSystem,measuredProperty,investment,vehicleType,Minibus,,,unit,BRL,observationPeriod,P1Y,name,"""Amount invested in the acquisition of minibuses by Mobility Structure Social Assistance System""",nameWithLanguage,"""Valor investido na aquisição de micro-ônibus pela Estrutura de Mobilidade no Sistema Único de Assistência Social@pt"""
Quantidade total de veículos entregues (doados),value,{Number},populationType,Vehicle,benefitProgram,BRA_MobilityStructureUnifiedSocialAssistanceSystem,,,vehicleStatus,Delivered,,,,,observationPeriod,P1Y,name,"""Number of Vehicles delivered by Mobility Structure Social Assistance System""",nameWithLanguage,"""Quantidade de veículos entregues pela Estrutura de Mobilidade no Sistema Único de Assistência Social@pt"""
Quantidade de Unidades de Acolhimento Municipal,value,{Number},populationType,Shelters,,,brazilCenterLevel,MunicipalLevel,censusStatus,CompletedCensus,brazilSystemType,BRA_UnifiedSocialAssistanceSystem,,,observationPeriod,P1Y,name,"""Number of Municipal shelters that completed Unified Social Assistance System Census""",nameWithLanguage,"""Quantidade de abrigos municipais que concluíram o Censo do Sistema Único de Assistência Social@pt"""
Quantidade de Unidades de Acolhimento Estadual,value,{Number},populationType,Shelters,,,brazilCenterLevel,StateLevel,censusStatus,CompletedCensus,brazilSystemType,BRA_UnifiedSocialAssistanceSystem,,,observationPeriod,P1Y,name,"""Number of State shelters that completed Unified Social Assistance System Census""",nameWithLanguage,"""Quantidade de abrigos estaduais que concluíram o Censo do Sistema Único de Assistência Social@pt"""
Quantidade de Unidades de Acolhimento Federal,value,{Number},populationType,Shelters,,,brazilCenterLevel,FederalLevel,censusStatus,CompletedCensus,brazilSystemType,BRA_UnifiedSocialAssistanceSystem,,,observationPeriod,P1Y,name,"""Number of Federal shelters that completed Unified Social Assistance System Census""",nameWithLanguage,"""Quantidade de abrigos federais que concluíram o Censo do Sistema Único de Assistência Social@pt"""
Total de quantidade das Unidades de Acolhimento,value,{Number},populationType,Shelters,,,,,censusStatus,CompletedCensus,brazilSystemType,BRA_UnifiedSocialAssistanceSystem,,,observationPeriod,P1Y,name,"""Number of shelters that completed Unified Social Assistance System Census""",nameWithLanguage,"""Quantidade de abrigos que concluíram o Censo do Sistema Único de Assistência Social@pt"""
Município com PMAS Regular - PMAS,value,{Number},populationType,CivicStructure,placeCategory,BRA_RegularModernizationSocialAssistanceProgram,,,,,,,,,observationPeriod,P1M,name,"""Number of Regular Program for Modernization of Social Assistance""",nameWithLanguage,"""Quantidade de Programas Regulares de Modernização da Assistência Social@pt"""
Conselho Municipal da Assistência Social Paritário - CPF,value,{Number},populationType,CivicStructure,placeCategory,BRA_MunicipalCouncilOfSocialAssistance,councilType,Paritary,registeredIn,IndividualTaxpayerRegistry,,,,,observationPeriod,P1M,name,"""Number of Municipal Councils for paritary Social Assistance with Individual Tax Register""",nameWithLanguage,"""Quantidade de Conselhos Municipais de Assistência Social Paritários com Cadastro Único de Beneficiários@pt"""
Município com PMAS Regular - CPF,value,{Number},populationType,CivicStructure,placeCategory,BRA_RegularModernizationSocialAssistanceProgram,registeredIn,IndividualTaxpayerRegistry,,,,,,,observationPeriod,P1M,name,"""Number of Regular Program for Modernization of Social Assistance with Individual Tax Register""",nameWithLanguage,"""Quantidade de Programas Regulares de Modernização da Assistência Social com Cadastro Único de Beneficiários@pt"""
Fundo Municipal da Assistência Social em situação regular - CPF,value,{Number},populationType,CivicStructure,placeCategory,BRA_RegularMunicipalSocialAssistanceFund,registeredIn,IndividualTaxpayerRegistry,,,,,,,observationPeriod,P1M,name,"""Number of Regular Municipal Social Assistance Fund with Individual Tax Register""",nameWithLanguage,"""Quantidade de Fundos Municipais Regulares de Assistência Social com Cadastro Único de Beneficiários@pt"""
Fundo Municipal da Assistência Social em situação regular - FMAS,value,{Number},populationType,CivicStructure,placeCategory,BRA_RegularMunicipalSocialAssistanceFund,,,,,,,,,observationPeriod,P1M,name,"""Number of Regular Municipal Social Assistance Fund""",nameWithLanguage,"""Quantidade de Fundos Municipais Regulares de Assistência Social@pt"""