key,prop,val,p1,v1,p2,v2,p3,v3,p4,v4,p5,v5,p6,v6
Referência,observationDate,{Data},observationAbout,country/BRA,benefitProgram,GasAidProgram,observationPeriod,P1M,,,,,,
Famílias Beneficiárias do Auxílio Gás,populationType,Household,value,{Number},,,,,,,name,"""The total number of families benefiting from gas aid programs.""",alternateName,"""O número total de famílias beneficiadas pelos programas de auxílio ao gás. @pt"""
Valor Total Repassado às famílias beneficiárias do Auxílio Gás,populationType,Household,measuredProperty,amount,unit,BRL,value,{Number},,,name,"""The total amount passed on to families benefiting from gas aid programs""",alternateName,"""O valor total repassado às famílias beneficiárias dos programas de auxílio ao gás @pt"""
Valor Médio do Benefício Auxílio Gás,populationType,Person,measuredProperty,amount,statType,meanValue,unit,BRL,value,{Number},name,"""The average amount of gas aid received by beneficiaries.""",alternateName,"""O valor médio do auxílio ao gás recebido pelos beneficiários. @pt"""
Pessoas beneficiárias do Auxílio Gás,populationType,Person,value,{Number},,,,,,,name,"""The total people benefiting from the gas aid programs""",alternateName,"""O total de pessoas beneficiadas pelos programas de ajuda ao gás @pt"""
Responsáveis Familiares do sexo Feminino beneficiárias do Auxílio Gás,populationType,Person,gender,Female,value,{Number},,,,,name,"""The total female family responsible persons beneficiaries of gas aid program""",alternateName,"""Total de responsáveis ​​familiares femininos beneficiários do programa de auxílio gás @pt"""
Percentual de Responsáveis Familiares do sexo Feminino,populationType,Household,gender,Female,unit,Percent,scalingFactor,100,value,{Number},name,"""The percentage of female family responsible beneficiaries of gas aid programs""",alternateName,"""A percentagem de mulheres responsáveis ​​familiares beneficiárias de programas de auxílio ao gás @pt"""