key,prop,val,p1,v1,p2,v2,p3,v3,p4,v4,p5,v5,,
Referência,observationDate,{Data},observationAbout,country/BRA,benefitProgram,Brazil_ContinuousCashBenefitProgram,benefitSource,MunicipalityBenefit,registrationStatus,Brazil_SingleRegistry,,,,
Pessoas com Deficiência (PCD) beneficiárias do BPC,value,{Number},populationType,Person,disabilityStatus,PermanentDisablity,description,"""Beneficiaries of BPC Registered in the Single Registry under Permanent Disability Paid By Municipality""",alternateName,"""Beneficiários do BPC Inscritos no Cadastro Único por Incapacidade Permanente Pago pelo Município@pt""",,,,
Idosos beneficiários do BPC,value,{Number},populationType,Person,age,[60 - Years],description,"""Beneficiaries of BPC Registered in the Single Registry under Elderly(Age>60 Yrs) Paid By Municipality""",alternateName,"""Beneficiários do BPC Inscritos no Cadastro Único Idosos (Idade>60 Anos) Pagos pelo Município@pt""",,,,
Valor Repassado a PCDs pelo BPC,value,{Number},measuredProperty,amount,populationType,EconomicActivity,disabilityStatus,PermanentDisablity,description,"""Total amount paid to beneficiaries of BPC Registered in the Single Registry under Permanent Disability""",alternateName,"""Valor total pago aos beneficiários do BPC Inscritos no Cadastro Único por Incapacidade Permanente@pt""",unit,BRL
Valor Repassado a Idosos pelo BPC,value,{Number},measuredProperty,amount,populationType,EconomicActivity,age,[60 - Years],description,"""Total amount paid to beneficiaries of BPC Registered in the Single Registry under Elderly(Age>60 Yrs)""",alternateName,"""Valor total pago aos beneficiários do BPC Inscritos no Cadastro Único para Idosos (Idade>60 Anos)""",unit,BRL
Total de Beneficiários do BPC,value,{Number},populationType,Person,description,"""Beneficiaries of BPC Registered in the Single Registry Paid By Municipality""",alternateName,"""Beneficiários do BPC Inscritos no Cadastro Único Pago pelo Município@pt""",,,,,,
Valor Total repassado ao BPC,value,{Number},measuredProperty,amount,populationType,EconomicActivity,description,"""Total amount paid to beneficiaries of BPC Registered in the Single Registry""",alternateName,"""Valor total pago aos beneficiários do BPC inscritos no Cadastro Único@pt""",measurementQualifier,Annual,unit,BRL